<?xml version="1.0" encoding="UTF-8"?>
<!ELEMENT bookstore (book+)>
<!ELEMENT book (id,name,author,year,price)>
<!ELEMENT id (#PCDATA)>
<!ELEMENT name (#PCDATA)>
<!ELEMENT author (#PCDATA)>
<!ELEMENT year (#PCDATA)>
<!ELEMENT price (#PCDATA)>
